Class,Star,Review
1,2,Go to Richfield location for much better food. This location is not worth the price. Food was lazily put together and fries were over cooked. Thought my burger was a terrible burger place until I went to Richfield location
1,1,"Went to Matt's today for the first time in years. For many years it has always been a never let you down Minneapolis staple. They would always make the fries consistently crunchy and better than McDonald's every time. They changed everything. Undercooked fries, smaller burger, less cheese and a new bun much bigger than the burger. Sorry Matt's, gotta find a new go to place for Juicy Lucy's. 5-8 or Nook........ You're up next."
1,1,Don't let the hype fool you. The Juicy Lucy at Matt's is a flavorless puck served with hard bar fries. You can easily find a better option.
1,1,"Do not waste your time as this joint (dive bar) has not a single redeeming quality. Lets cut to the chase - the over-hyped and famous ""jucy lucy"" is just two patties, way-overcooked with some very runny cheese (I thought real cheese was thicker). The burger flavor could be replicated almost anywhere else. Oh, at a cost of $7.50!! And, the bar was not very clean either. I felt like a sucker.

Now, when combined with limited street parking, no silverware (not even plastic, right?), the cheapest quality napkins made, no fruit (no orange slice for your beer) and finally, you had to wait at the bar for the bartender to pay your tab. Well, the whole experience was disgusting and not to be repeated."
1,1,New ownership. Was on bizarre foods. Ate there two weeks ago after going for over 40 years. Had warm draft beer. Cold fries. A hockey puck on a hard cold bun. Heart broken. Won't go back. At first just thinking they were having a bad day then I saw it changed owners and that explains the disappointment.
1,1,"Overrated! My sister insists on taking our out of town guests here to sample a true Minnesotan experience because of Matt's claim to fame as inventor of the Jucy Lucy. But that's where the novelty ends. 

Yes, please take your guests here if you want the experience of a long ass wait for dive bar with a single rude waitress giving constant side eye for mediocre grease bomb burgers and floppy fries. The wait probably wouldn't be so long if they had a normal kitchen rather than a single burger flipper behind the bar making all the burgers on a small griddle.

Seriously go elsewhere, there are so many other choices for a delicious Jucy Lucy in the cities! Blue door, the nook, and Shamrocks for example."
1,1,"I really wanted to like this place but will not be back.  Liked the idea of the burgers but unfortunately the meat is so overcooked it's practically petrified- I guess in order to melt the cheese sufficiently.  Beer selection is underwhelming.  All of that would be totally acceptable (almost preferable!) for a dive bar, but what I cannot overlook is how rude the staff is.  There is no need for those bad vibes when there is already so much negativity in the world right now... and there are so many better bars in the Twin Cities."
1,1,"I only reviewed a restaurant one other time and it was because it was so good. I am writing this review on Matts because it was so bad. We have been to Matts many times. We have always thought they made the very best hamburger. We put them on top of ""the best hamburger"" spots in Minneapolis/St Paul. We went to Matts for a late lunch last Monday. My husband and I ordered a cheeseburger and fries. I could not believe how horrible the cheeseburger looked. The patty was a 1/4"" thick and the size of a silver dollar. My husband says his was a little larger diameter. They were both dry and overcooked. The bun was just a bun.  The cheese was a small square of thin cheese. Needless to say, you got a lot of bread and very little meat and cheese. So disappointing. 

The fries were ok. My husband likes them better than me because he likes crunchy, small French fries. 

In Matts defense, I think in the past I have ordered the Juicy Lucy or Double Cheeseburger. Perhaps they are just so much better than the plain cheeseburger. But if so, warn your customer. I won't go back. I'll go to the other ""best hamburger"" spots"
1,1,Waited at the front to be seated like any place. Was helped immediately and directed to a booth seat. We witnessed four other groups come in and be seated while we waited. Twenty minutes passed and in that time we saw all four of those tables be able to place their orders. We must have been forgotten about because not once did anyone come ask us if we've been helped or would like to get started with beverages. As we were about to leave the waitress finally came over for our order. Only stayed because of the reputation of the juicy lucy. My husband and I ordered juicy lucy burgers and our daughter ordered a cheeseburger. Our juicy Lucy burgers were good but halfway through my daughter eating her burger we noticed her's was not cooked thoroughly. Waitress discounted our bill and asked if we wanted a burger to go and we rejected. Just really upset our visit ended like this being we only heard so much great reviews about it.
1,1,"Had the Jucy Lucy. Was in no way juicy. If you're looking for a burger that had been overcooked to the point that  you have to follow every bite with a swig of H2O, this is the place for you. Seriously, I've never had a worse burger.

The fries were okay though.

Be prepared to wait forever for the lump of coal to arrive - 24 minutes was the total time for mine. That could've been cut in half had the grillmeister not insisted on evaporating every molecule of moisture in the burger."
1,1,"I guess if you have a hankering for 60's style burgers, this is your place. It's not worth the wait, the price or the exceptionally rude waitress. The burger was black on the edges, grey on the inside with a burst of hot cheese that makes it palatable at first but gets monotonous 
very quickly. My Coke was warm and they don't have ice - don't bother asking since the waitress will belittle you for asking. She practically bit the head off my husband when he asked if they had water. She then asked, ""Why would you ask if we have water? This is a restaurant and like any other restaurant we have water?""  His reply, ""Maybe a restaurant that doesn't have ice might not have water!""  If you want an exceptional burger, there are far better places that are clean and have a wait staff that treats you like a customer, not a nuisance. Victory 44 is one of them."
1,1,"Everything sucked about this place. Food was bad, especially Jucy Lucy. Crappy selection of beers and wine is terrible. It seemed dirty in there . Don't go there if you have any class! Way overhyped,it deserves 3 stars maximum. Their French freeze is frozen and burgers too with shitty cheese"
1,1,"This place sucks.   Low energy, low quality crap food.  You have to be a drunk to think this is good.   This place is at least 50 years old and they have not improved anything.    I love vintage, nostalgia, home cooking etc, but the food is very low quality $7.25 for a juicy Lucy.  Almost double the price of in n out burger for a much fresher, quality product. 

When a place has 849 reviews you expect something delicious.    Not!! 

The place was dead.  It has one piece of American cheese in this over cooked disaster.   

I really enjoyed the small open kitchen but jeez this place sucks.  

If your a foodie this is a waste of money time and energy.   If your a drunk trying to sober up eat this.  

I feel sorry for people that think this is good.  Try Tommys Malt Shop for a place that makes really good,tasty, high quality food.  I'm just passing through town.  I would Never recommend this place.   Rough area as well w people drinking alcohol on the street."
1,1,"Trip #1:
No flavor even with the amount of cheese inside. I've heard from others through discussion that it's a so called ""hockey puck"". If you order it with onions, you'll simply be receiving a gourmet or glorified White Castle version of a juicy. I think they're relying on the age of the flat top to cook flavoring into their juicy's, but it's not working...

Trip #2:
I dubbed my second trip, Second Chance Saturday (it was of course a Saturday) and thankfully, it's cheap to eat here! Awards all over the place from MSP Mag for best burger and best juicy lucy and I just have one question.... How? Who ever is voting for this place for these awards needs to spend some time exploring more than just 1 place, because it was still nothing to brag about! People wait in a line out the door for these and I could think of plenty of other places I would rather eat at over this place.

Trip #3:
Refuse to attempt trip #3, it's disgusting food!

#knowbeforeyougo"
1,1,"Juicy Lucy's are undercooked in the middle.
Most important....They don't have an Ice Maker???
Your drinks are served warm???
Who wants warm water or warm pop?
Always packed so there's no where to sit.
Food takes forever to get to you and then you end up standing."
